{
  "schema_version": "1.0.0",
  "gate_id": "GATE-002",
  "decision": "GREEN",
  "decision_actor": "human",
  "report_sha256": "d3240674f777f5ba1fd9d8b06535555f0625111cd102f1b3184e790f8d7f817a",
  "reviewed_at_utc": "2026-07-17T12:12:35Z",
  "checklist_items": [
    {
      "check_id": "automated_report_reviewed",
      "outcome": "checked"
    },
    {
      "check_id": "evidence_links_verified",
      "outcome": "checked"
    },
    {
      "check_id": "privacy_redaction_reviewed",
      "outcome": "checked"
    },
    {
      "check_id": "physical_or_human_observations_approved",
      "outcome": "checked"
    }
  ],
  "signature_sha256": "031a78ce4205248ffe1279e0a311c29bdfb9f42724a9ca1b506d216184000ac4"
}
